<?xml version="1.0" encoding="UTF-8" ?>
<FacturaCompra xmlns:xsi="http://www.w3.org/2001/XMLSchema-instance" xsi:noNamespaceSchemaLocation="http://172.19.127.101:9090/grupo01/Facturas/xsd/FacturasCompra.xsd">
  <NumeroFactura>1</NumeroFactura>
  <FechaCompra>2015-06-09</FechaCompra>
  <Proveedor>CompuFax</Proveedor>
  <Usuario>Admin</Usuario>
  <LineasFactura>
    <LineaFactura NumeroLineaFactura="1">
      <Articulo Codigo="FP110" Cantidad="12" CantMaxima="40" CantMinima="5" Descripcion="Fuente de poder"
       EstadoArticulo="Activo" Familia="CPU" Marca="HP" PrecioMercDolares="50" UnidadMedida="un"/>
    </LineaFactura>
    <LineaFactura NumeroLineaFactura="2">
      <Articulo Codigo="FTCO2175" Cantidad="30" CantMaxima="46" CantMinima="1" Descripcion="Pantalla Plana 21 pul"
       EstadoArticulo="Activo" Familia="Monitores" Marca="Toshiba" PrecioMercDolares="100" UnidadMedida="un"/>
    </LineaFactura>
    <LineaFactura NumeroLineaFactura="3">
      <Articulo Codigo="INCOHO" Cantidad="33" CantMaxima="40" CantMinima="7" Descripcion="Impresora Color"
       EstadoArticulo="Activo" Familia="Impresoras" Marca="Lexmark" PrecioMercDolares="56" UnidadMedida="un"/>
    </LineaFactura>
  </LineasFactura>
</FacturaCompra>
